{
  "schemaVersion": 1,
  "kind": "model",
  "id": "qwen3-coder-next-q4-k-m",
  "name": "Qwen3-Coder-Next · 官方 Q4_K_M",
  "description": "编程与代理任务专用候选；官方 80B-A3B GGUF，给 128 GiB 单机保留运行余量。需外部 llama.cpp。",
  "family": "Qwen3-Coder",
  "architecture": "qwen3_next",
  "format": "gguf",
  "quantization": "Q4_K_M",
  "source": {
    "repo": "Qwen/Qwen3-Coder-Next-GGUF",
    "revision": "b82fb7382639d97b38fa7672e526c760c2fb358e"
  },
  "downloads": {
    "global": [
      {
        "label": "Hugging Face · 固定版本",
        "url": "https://huggingface.co/Qwen/Qwen3-Coder-Next-GGUF/tree/b82fb7382639d97b38fa7672e526c760c2fb358e",
        "revision": "b82fb7382639d97b38fa7672e526c760c2fb358e",
        "verification": "upstream",
        "manifestUrl": null,
        "manifestSha256": null
      }
    ],
    "cn": []
  },
  "requirements": {
    "systemRamGiB": null,
    "gpuMemoryGiB": null,
    "diskBytes": 48410992032,
    "notes": "只下载 Qwen3-Coder-Next-Q4_K_M/ 下 4 个分片，不下载其他量化。社区已有 GB10 部署配方；从 8K–16K、并发 1 验证，不将模型标称最大上下文当作本机验收值。 以下为单机 128 GiB Linux GB10 的选型建议，未完成本版本的 Sparklet 实机验收。文件体积不是运行内存；需另留系统、加载临时空间、KV cache 和运行环境磁盘空间。 当前 Sparklet 未接入此架构或量化，需使用所述外部引擎。"
  },
  "hardware": [
    {
      "id": "nvidia-dgx-spark",
      "name": "NVIDIA DGX Spark / GB10 / Linux / 128 GiB",
      "status": "unverified",
      "reportIds": []
    }
  ],
  "curation": {
    "originCountry": "CN",
    "rank": 30,
    "reviewedAt": "2026-10-27",
    "downloads30d": 46020,
    "evidence": [
      "https://huggingface.co/Qwen/Qwen3-Coder-Next-GGUF/blob/b82fb7382639d97b38fa7672e526c760c2fb358e/README.md",
      "https://github.com/eugr/spark-vllm-docker"
    ],
    "files": [
      {
        "path": "Qwen3-Coder-Next-Q4_K_M/Qwen3-Coder-Next-Q4_K_M-00001-of-00004.gguf",
        "bytes": 15524827040
      },
      {
        "path": "Qwen3-Coder-Next-Q4_K_M/Qwen3-Coder-Next-Q4_K_M-00002-of-00004.gguf",
        "bytes": 14872168352
      },
      {
        "path": "Qwen3-Coder-Next-Q4_K_M/Qwen3-Coder-Next-Q4_K_M-00003-of-00004.gguf",
        "bytes": 14503294496
      },
      {
        "path": "Qwen3-Coder-Next-Q4_K_M/Qwen3-Coder-Next-Q4_K_M-00004-of-00004.gguf",
        "bytes": 3510702144
      }
    ]
  }
}
