{
  "schemaVersion": 1,
  "kind": "model",
  "id": "qwen3-4b-instruct-2507-bf16",
  "name": "Qwen3 4B Instruct 2507 · BF16",
  "description": "轻量指令遵循与低延迟；当前 Sparklet 已有对应架构，可登记后手动下载。",
  "family": "Qwen3",
  "architecture": "qwen3",
  "format": "safetensors",
  "quantization": "BF16",
  "source": {
    "repo": "Qwen/Qwen3-4B-Instruct-2507",
    "revision": "cdbee75f17c01a7cc42f958dc650907174af0554"
  },
  "downloads": {
    "global": [
      {
        "label": "Hugging Face · 固定版本",
        "url": "https://huggingface.co/Qwen/Qwen3-4B-Instruct-2507/tree/cdbee75f17c01a7cc42f958dc650907174af0554",
        "revision": "cdbee75f17c01a7cc42f958dc650907174af0554",
        "verification": "upstream",
        "manifestUrl": null,
        "manifestSha256": null
      }
    ],
    "cn": []
  },
  "requirements": {
    "systemRamGiB": null,
    "gpuMemoryGiB": null,
    "diskBytes": 8060907830,
    "notes": "使用官方未量化 safetensors。Sparklet 的 Qwen3 适配器为非思考模式、普通 attention、单请求解码；先用 CUDA、4K 上下文验证，较长上下文会增加注意力临时空间及 KV 内存。可登记不等于此固定版本已在本机验收。 以下为单机 128 GiB Linux GB10 的选型建议，未完成本版本的 Sparklet 实机验收。文件体积不是运行内存；需另留系统、加载临时空间、KV cache 和运行环境磁盘空间。"
  },
  "hardware": [
    {
      "id": "nvidia-dgx-spark",
      "name": "NVIDIA DGX Spark / GB10 / Linux / 128 GiB",
      "status": "unverified",
      "reportIds": []
    }
  ],
  "curation": {
    "originCountry": "CN",
    "rank": 80,
    "reviewedAt": "2026-10-27",
    "downloads30d": 2653004,
    "evidence": [
      "https://huggingface.co/Qwen/Qwen3-4B-Instruct-2507/blob/cdbee75f17c01a7cc42f958dc650907174af0554/README.md"
    ],
    "files": [
      {
        "path": "LICENSE",
        "bytes": 11343
      },
      {
        "path": "config.json",
        "bytes": 727
      },
      {
        "path": "generation_config.json",
        "bytes": 238
      },
      {
        "path": "merges.txt",
        "bytes": 1671839
      },
      {
        "path": "model-00001-of-00003.safetensors",
        "bytes": 3957900840
      },
      {
        "path": "model-00002-of-00003.safetensors",
        "bytes": 3987450520
      },
      {
        "path": "model-00003-of-00003.safetensors",
        "bytes": 99630640
      },
      {
        "path": "model.safetensors.index.json",
        "bytes": 32819
      },
      {
        "path": "tokenizer.json",
        "bytes": 11422654
      },
      {
        "path": "tokenizer_config.json",
        "bytes": 9377
      },
      {
        "path": "vocab.json",
        "bytes": 2776833
      }
    ]
  }
}
