{
  "schemaVersion": 1,
  "kind": "model",
  "id": "qwen3.8-flash-next-ud-q4-k-xl",
  "name": "Qwen3.8-Flash-Next · Unsloth UD-Q4_K_XL",
  "description": "保留的高容量 Q4 大模型备选；单机内存余量较紧。需对应 GGUF 服务构建。",
  "family": "Qwen3.8",
  "architecture": "qwen3.8",
  "format": "gguf",
  "quantization": "UD-Q4_K_XL",
  "source": {
    "repo": "unsloth/Qwen3.8-Flash-Next-GGUF",
    "revision": "766911a6b7369840a91dbcd95f9f997acaab6cd6"
  },
  "downloads": {
    "global": [
      {
        "label": "Hugging Face · 固定版本",
        "url": "https://huggingface.co/unsloth/Qwen3.8-Flash-Next-GGUF/tree/766911a6b7369840a91dbcd95f9f997acaab6cd6",
        "revision": "766911a6b7369840a91dbcd95f9f997acaab6cd6",
        "verification": "upstream",
        "manifestUrl": null,
        "manifestSha256": null
      }
    ],
    "cn": []
  },
  "requirements": {
    "systemRamGiB": null,
    "gpuMemoryGiB": null,
    "diskBytes": 111334654784,
    "notes": "只下载 UD-Q4_K_XL/ 的 4 个分片。约 111.3 GB 文件，PLE 映射、计算权重、KV 与加载临时分配须分开评估；从 4K、并发 1 验证，不作为免验收的默认首选。 以下为单机 128 GiB Linux GB10 的选型建议，未完成本版本的 Sparklet 实机验收。文件体积不是运行内存；需另留系统、加载临时空间、KV cache 和运行环境磁盘空间。"
  },
  "hardware": [
    {
      "id": "nvidia-dgx-spark",
      "name": "NVIDIA DGX Spark / GB10 / Linux / 128 GiB",
      "status": "unverified",
      "reportIds": []
    },
    {
      "id": "nvidia-rtx-spark",
      "name": "NVIDIA RTX Spark / Windows UMA",
      "status": "unverified",
      "reportIds": []
    }
  ],
  "curation": {
    "originCountry": "CN",
    "rank": 190,
    "reviewedAt": "2026-10-27",
    "downloads30d": 1064465,
    "evidence": [
      "https://huggingface.co/unsloth/Qwen3.8-Flash-Next-GGUF/blob/766911a6b7369840a91dbcd95f9f997acaab6cd6/README.md"
    ],
    "files": [
      {
        "path": "UD-Q4_K_XL/Qwen3.8-Flash-Next-UD-Q4_K_XL-00001-of-00004.gguf",
        "bytes": 10946624
      },
      {
        "path": "UD-Q4_K_XL/Qwen3.8-Flash-Next-UD-Q4_K_XL-00002-of-00004.gguf",
        "bytes": 49859583136
      },
      {
        "path": "UD-Q4_K_XL/Qwen3.8-Flash-Next-UD-Q4_K_XL-00003-of-00004.gguf",
        "bytes": 49376141504
      },
      {
        "path": "UD-Q4_K_XL/Qwen3.8-Flash-Next-UD-Q4_K_XL-00004-of-00004.gguf",
        "bytes": 12087983520
      }
    ]
  }
}
