{
  "schemaVersion": 1,
  "kind": "model",
  "id": "qwen3.6-35b-a3b-nvfp4",
  "name": "Qwen3.6 35B-A3B · NVIDIA NVFP4",
  "description": "低延迟中文对话、工具调用与编程候选；稀疏 MoE。需外部 vLLM。",
  "family": "Qwen3.6",
  "architecture": "qwen3_5_moe",
  "format": "safetensors",
  "quantization": "NVFP4",
  "source": {
    "repo": "nvidia/Qwen3.6-35B-A3B-NVFP4",
    "revision": "1355db6a052410cfd62085d94b58866fd0f2c3c5"
  },
  "downloads": {
    "global": [
      {
        "label": "Hugging Face · 固定版本",
        "url": "https://huggingface.co/nvidia/Qwen3.6-35B-A3B-NVFP4/tree/1355db6a052410cfd62085d94b58866fd0f2c3c5",
        "revision": "1355db6a052410cfd62085d94b58866fd0f2c3c5",
        "verification": "upstream",
        "manifestUrl": null,
        "manifestSha256": null
      }
    ],
    "cn": []
  },
  "requirements": {
    "systemRamGiB": null,
    "gpuMemoryGiB": null,
    "diskBytes": 23457714000,
    "notes": "NVIDIA 模型卡提供 DGX Spark 专用启动配方。MoE 仅激活部分参数不表示其余专家权重不占内存。建议从 8K、并发 1 验证；长上下文、图片及投机解码另占空间。 以下为单机 128 GiB Linux GB10 的选型建议，未完成本版本的 Sparklet 实机验收。文件体积不是运行内存；需另留系统、加载临时空间、KV cache 和运行环境磁盘空间。 当前 Sparklet 未接入此架构或量化，需使用所述外部引擎。"
  },
  "hardware": [
    {
      "id": "nvidia-dgx-spark",
      "name": "NVIDIA DGX Spark / GB10 / Linux / 128 GiB",
      "status": "unverified",
      "reportIds": []
    }
  ],
  "curation": {
    "originCountry": "CN",
    "rank": 20,
    "reviewedAt": "2026-10-27",
    "downloads30d": 4153731,
    "evidence": [
      "https://huggingface.co/nvidia/Qwen3.6-35B-A3B-NVFP4/blob/1355db6a052410cfd62085d94b58866fd0f2c3c5/README.md",
      "https://github.com/eugr/spark-vllm-docker"
    ],
    "files": [
      {
        "path": "chat_template.jinja",
        "bytes": 7764
      },
      {
        "path": "config.json",
        "bytes": 58110
      },
      {
        "path": "configuration.json",
        "bytes": 58
      },
      {
        "path": "generation_config.json",
        "bytes": 202
      },
      {
        "path": "hf_quant_config.json",
        "bytes": 35085
      },
      {
        "path": "model-00001-of-00003.safetensors",
        "bytes": 10006877608
      },
      {
        "path": "model-00002-of-00003.safetensors",
        "bytes": 10003595752
      },
      {
        "path": "model-00003-of-00003.safetensors",
        "bytes": 3413864960
      },
      {
        "path": "model.safetensors.index.json",
        "bytes": 13726227
      },
      {
        "path": "preprocessor_config.json",
        "bytes": 390
      },
      {
        "path": "tokenizer.json",
        "bytes": 12807982
      },
      {
        "path": "tokenizer_config.json",
        "bytes": 16718
      },
      {
        "path": "video_preprocessor_config.json",
        "bytes": 385
      },
      {
        "path": "vocab.json",
        "bytes": 6722759
      }
    ]
  }
}
