{
  "schemaVersion": 1,
  "kind": "model",
  "id": "qwen3-0.6b",
  "name": "Qwen3 0.6B",
  "description": "Qwen3 系列小型文本模型。",
  "family": "Qwen3",
  "architecture": "qwen3",
  "format": "safetensors",
  "quantization": "BF16",
  "source": {
    "repo": "Qwen/Qwen3-0.6B",
    "revision": "c1899de289a04d12100db370d81485cdf75e47ca"
  },
  "downloads": {
    "global": [
      {
        "label": "Hugging Face · 固定版本",
        "url": "https://huggingface.co/Qwen/Qwen3-0.6B/tree/c1899de289a04d12100db370d81485cdf75e47ca",
        "revision": "c1899de289a04d12100db370d81485cdf75e47ca",
        "verification": "upstream",
        "manifestUrl": null,
        "manifestSha256": null
      }
    ],
    "cn": []
  },
  "requirements": {
    "systemRamGiB": null,
    "gpuMemoryGiB": null,
    "diskBytes": 1514744783,
    "notes": "文件体积不等于运行内存；下载和解压需另留磁盘余量。内存需求及上下文对应关系等待可复现实测，不据此自动配置运行参数。"
  },
  "hardware": [
    {
      "id": "nvidia-rtx-spark",
      "name": "NVIDIA RTX Spark / Windows UMA",
      "status": "unverified",
      "reportIds": []
    }
  ]
}
